{"schemaVersion":"1.0.0","kind":"approvals","mode":"fixture","updatedAt":"2026-08-22T00:00:00.000Z","items":[{"id":"approve-raven-post","action":"Approve Raven Sharp weekly post","reason":"Content is ready for owner review before scheduling.","risk":"low","status":"pending","category":"content","priority":2},{"id":"approve-checkout-deploy","action":"Approve checkout repair deployment","reason":"The fixture repair branch records 18 passing tests; production remains gated.","risk":"medium","status":"pending","category":"deployment","priority":1}]}
