{"schemaVersion":"1.0.0","kind":"content","mode":"fixture","updatedAt":"2026-08-22T00:00:00.000Z","items":[{"id":"content-raven-weekly","title":"Raven Sharp weekly insight","channel":"LinkedIn","status":"awaiting-approval","scheduledFor":"2026-08-24T23:00:00.000Z","owner":"Content agent"},{"id":"content-ascension-case-study","title":"Automation case study","channel":"Website","status":"draft","scheduledFor":null,"owner":"Growth agent"}]}
