{"schemaVersion":"1.0.0","kind":"finance","mode":"fixture","updatedAt":"2026-08-22T00:00:00.000Z","items":[{"id":"finance-income-aug","label":"August income","category":"income","amount":8420,"currency":"AUD","status":"estimated"},{"id":"finance-expenses-aug","label":"August operating expenses","category":"expense","amount":2310,"currency":"AUD","status":"estimated"},{"id":"finance-tax-quarter","label":"Quarterly tax records","category":"tax","amount":0,"currency":"AUD","status":"needs-reconciliation"}]}
