{"schemaVersion":"1.0.0","kind":"assets","mode":"fixture","updatedAt":"2026-08-22T00:00:00.000Z","items":[{"id":"asset-raven-home-preview","title":"Raven Sharp homepage preview","type":"screenshot","status":"ready","preview":"/previews/raven-home.png","business":"Raven Sharp"},{"id":"asset-ascension-campaign","title":"Ascension campaign creative","type":"image","status":"review","preview":null,"business":"Ascension Digital"}]}
