{"schemaVersion":"1.0.0","kind":"repairs","mode":"fixture","updatedAt":"2026-08-22T00:00:00.000Z","items":[{"id":"repair-checkout-handoff","title":"Repair checkout handoff regression","status":"branch-ready","priority":"critical","branch":"codex/repair-checkout-handoff","tests":{"passed":18,"failed":0},"preview":null},{"id":"repair-meta-description","title":"Improve Ascension meta description","status":"suggested","priority":"medium","branch":null,"tests":null,"preview":null}]}
